{
  "schema_version": "scorer-profile/v1",
  "candidate": {
    "schema_version": "package-candidate/v1",
    "package_id": "synthetic-skill",
    "source_revision": "1111111111111111111111111111111111111111",
    "content_sha256": "aaaaaaaaaaaaaaaaaaaaaaaaaaaaaaaaaaaaaaaaaaaaaaaaaaaaaaaaaaaaaaaa"
  },
  "scorer_id": "synthetic-scorer",
  "scorer_type": "external",
  "version_or_digest": "v1",
  "pass_threshold": 0.85,
  "deterministic_checks_first": true,
  "calibration_required": true,
  "calibration_probe_ids": ["positive", "negative"]
}
